{"schema_version":"1.0.0","record_id":"0b6f7c1e-3a2d-4c5e-9f10-1a2b3c4d5e03","source_id":"synthetic/ep3","record_type":"verified_outcome","epistemic_status":"replicated","subject":"Transpiler::Lua->Python::switch","claim":"regressed","timestamps":{"observed_at":"2026-03-01T00:00:00Z","recorded_at":"2026-03-01T00:05:00Z","valid_from":"2026-03-01T00:00:00Z","valid_until":null},"confidence":{"value":1.0,"method":"executed_test"},"citations":[{"kind":"internal","ref":"lattice-ai-evolution@6eef16ef:benchmarks/graphiti/graphiti-temporal-fixture.json"}],"provenance":[{"agent_id":"ci:ws2","timestamp":"2026-03-01T00:05:00Z","action":"verified","input_ids":["synthetic/ep2"],"tool":"pytest","tool_version":"8.3.3"}],"supersedes":["0b6f7c1e-3a2d-4c5e-9f10-1a2b3c4d5e02"],"superseded_by":null,"historical_validity":{"valid_from":"2026-03-01T00:00:00Z","valid_until":null,"retained":true},"tags":["synthetic"]}
