{"schema_version":"1.0.0","record_id":"0b6f7c1e-3a2d-4c5e-9f10-1a2b3c4d5e01","source_id":"messier:M31","record_type":"observation","epistemic_status":"observed","subject":"M31","claim":"Apparent visual magnitude","physical_units":[{"name":"apparent_magnitude","value":3.44,"unit":"mag","uncertainty":{"kind":"symmetric","sigma":0.05}}],"coordinates":{"ra_deg":10.6847,"dec_deg":41.2690,"epoch":"J2000","frame":"ICRS"},"timestamps":{"observed_at":"2026-01-10T12:00:00Z","recorded_at":"2026-01-11T00:00:00Z","valid_from":"2026-01-10T12:00:00Z","valid_until":null},"uncertainty":{"kind":"symmetric","sigma":0.05},"confidence":{"value":0.95,"method":"catalog_reported"},"citations":[{"kind":"url","ref":"https://github.com/mardukasoka/uranometria"}],"provenance":[{"agent_id":"uranometria/parse:messier","timestamp":"2026-01-11T00:00:00Z","action":"parsed","commit_sha":"7b43ac6"}],"historical_validity":{"valid_from":"2026-01-10T12:00:00Z","valid_until":null,"retained":true},"tags":["messier","galaxy"],"classification":{"domain":"astronomy","category":"deep-sky"}}
