{"schema_version":"1.0.0","record_id":"0b6f7c1e-3a2d-4c5e-9f10-1a2b3c4d5e02","source_id":"chess-atlas:experiments/matter/phase-transition-schema","record_type":"hypothesis","epistemic_status":"candidate","subject":"quark-gluon plasma crossover","claim":"Critical endpoint exists at finite baryon chemical potential","physical_units":[{"name":"temperature","value":155,"unit":"MeV","uncertainty":{"kind":"asymmetric","plus":5,"minus":8}}],"coordinates":{"x":0,"y":0,"z":0,"frame":"phase-diagram:T-muB"},"timestamps":{"recorded_at":"2026-02-01T00:00:00Z","valid_from":"2026-02-01T00:00:00Z"},"confidence":{"value":0.4,"method":"expert_estimate"},"citations":[{"kind":"doi","ref":"10.1103/PhysRevD.101.054504"}],"provenance":[{"agent_id":"human:reviewer","timestamp":"2026-02-01T00:00:00Z","action":"ingested"}],"supersedes":[],"superseded_by":null,"historical_validity":{"valid_from":"2026-02-01T00:00:00Z"},"tags":["qcd"]}
